author_id,text,cEXT,cNEU,cAGR,cCON,cOPN,label
4d035bd3fd8d9595d15cea9e388964be,"Today is another day. You dont get better by making a right choice once. You get better by making the right choice... everyday... over and over again... || had a wonderful night with family and friends... the night cap was wonderful though... WEEEEE!! I got my shirt!!! || just watched an episode of locked up abroad... dont take your freedom for granted people... its a blessing... || There can be no complaints from the Arsenal fans about today's results... wunna get wash off... || Jesus said to love others as you love yourself... So FIRST you have to love yourself!! || so not a day for work... good thing I'm working nights this week... :D || is happy for his gf. Congrats babe, I knew you could do it!! || had a great weekend with her... we have to do that again babe... || After a slight rebuild... Betsy 2.0 lives to surf the net again!! || is worn and battle weary... but i refuse to give up... || first time in a long time... I feel like writing... || is kinda having a rough morning... but its looking up... || is back home... sleepy but cant sleep just yet... || has tied up one loose end... feels lighter already || is at an interesting stage in his life... || is going to spend some time with her... || is living life one day at a time || is etching closer to becoming stir crazy.. || has had an interesting start to saturday || is doing to die to self... || is trying to fight it off || needs to tie up loose ends... || is still patiently waiting for 9 || is going to die to self || had a great day at church... || is going to sleep... soon",high,high,low,low,high,11001
4e5bc97d95f3aca05d420bfd4e3a2639,"just received an extra 360 kb of storage for his computer in the form of a 5 1//4"" floppy from the guy near me who's retiring.  It's going to come in handy for that extra 20 seconds of music that won't fit on my hard drive. || is slightly disappointed to find out that you harvest horsehair from the horses on Farmville rather than, say, glue or dog food.  Does that make me a bad person? || is wondering if both of these teams should be kicked out of the NFL.  I think the top 5 NCAA teams could easily beat either of these teams. || has the same feelings about Up in the Air as Homer did about the three little pigs animatronics at Storytime Village.  ""That was good... but not great."" || just found out that *PROPNAME* wrote both the Band-Aid song and the State Farm song.  *PROPNAME*.  For real.  I couldn't believe it either. || is watching the USA play Switzerland in hockey and thinks the announcers should say that the Swiss team is full of holes. || can't believe we ordered the 250,000 chocolate bag at Red Light and won four free chef's tasting meals, complete with wine pairings! || Out of work as of January 15th, anybody with any leads in structural engineering, please let me know. || Sex can screw things up.  Why do you think the Three Stooges went through so many *PROPNAME*'s? || can't wait to have all the stuff moved into the new place in Oak Park today! || is glad that apparently there is no law of diminishing comedic returns with space poop || is not happy that *PROPNAME* pulled a Blaise.  I'll still go to your restaurant *PROPNAME*! || I don't mean to swear, but I am really irritated right now! || Why am I always asleep during the earthquakes?  I never feel them! || Bad Office!  You know better than to do a clip show. || thinks they should add tomacco as a crop on farmville. || thinks you guys have more brains than a zombie Thanksgiving.",high,low,high,low,high,10101
4f48c6c8051e144c717ce143e8d77782,"To my veteran friends, family, and strangers alike; I would like to say Thank You. Thank you for the sacrifices you have made for my safety, my freedoms, and my country. God Bless you all. || I don't understand why some people make it so hard for you to be nice to them. I dont understand why I'm worrying about it anyway, they sure aren't. || Back to work. Trying to get everything cleaned up before the New Year. If you saw my desk, you would understand why I am starting now :) || Upon what basis do we judge other people? Is it ithe experiances that we ourselves have, or the belifes in which we hold? || What sad news for the Gator nation today, the resignation of Urban Meyer. Our prayers will be with Coach Meyer and his family. || Go Gators! 8 and 0.... Now, lets see if the Vols help us clench the SEC east :) oh, and HAPPY HALLOWEEN!!! || I'm getting calls back on my resume, it makes me hopefull I will find the right job :) || Do you remember that song ""Break Stuff"" by Limp Bizkit? Thats kind of the day I'm having. || I have SO happy the Ravens are getting a good start today! I love playoff football. || I love Mondays.... can every one grasp the sarcasm in that statement. I hope so. || enjoyed the football and fun of the weekend, and now its back to reality. || People should not encourage me to drink until 4 o'clock in the morning :( || I don't want to get sick, but I think it's happening anyway :( || Who can tell me how to not be a fan of something anymore? || Can't decided if she is going to Jacksonville Saturday or not. || and the Bucs pull it out in Overtime! Way to go! || I just can't get into the swing of things today. || just can't get into the Monay state of mind. || is unemployed, and thinks its a good thing :) || Thanksgiving cooking! Fun or stressful, I'll decide later. || *PROPNAME* leaves the SEC, HOORAY",low,high,high,low,high,01101
502db2fcfe26705ae16a46c5cb2ad2e5,"in times that are tough you really learn something new about yoursrlf, your life, the path your taking and the people around you. im happy for this and my life is great at this very moment i dont want it to change anything.  this is a new chapter!!! || just a question to all off my friends!!! do you think that a REAL INDIGO would be racist???? i thought we were here to help others not put them into a catagory where we critisize people over something they have no control over i find this quite disturbing || didnt even realise Bendigo cup was on 2morrow hahaha need to get updated with the times :) anyways got portraits today and they were absolutly fantastic!!! hmmm what can i do 2morrow, got alot of housework to catch up on which sucks bigtime :( its never ending! || How many really know what love is? Millions never will Do you know until you lose it That it's everything that we are looking for When I wake up in the morning You're beside me I'm so thankful that I found Everything that I been looking for || Many that live deserve death. And some that die deserve life. Can you give it to them? Then do not be too eager to deal out death in judgement. For even the very wise cannot see all ends. Tolkein (lord of the rings) || Free your mind, Freen your thought, think outside the box, we have to restore balance in the world or we will cease to exist come on think about what is really going on in the world can we afford to be so selfish!!! || ""look not from the mind, but from the soul. For the life that is coming is already before us, waiting to open up the world. just look more closely. find the eyes to see."" || I do not love the bright sword for it's sharpness, nor the arrow for it's swiftness, nor the warrior for his glory. I love only that which they defend Tolkein (lord of the rings) || + Being able to relate to or think about the unknown is half the battle of expanding your spiritual beliefs. Having the opportunity to experience it personally is the other half. - *PROPNAME* || some people really get under my skin, i love intellegence at the same time have a low tolerance for stupidity, on the upside i got myself some new books and remedies to test!!! || The key to realizing a dream is to focus not on success but significance - and then even the small steps and little victories along your path will take on greater meaning. || cannot believe some people!!! you do nice things for someone and they take you for granted! well this is the last straw for me NO MORE will i help this person! || cant wait till MAGICK HAPPENS!!! taking ash and my little girl with me!!! anyways off to bed to dream my night away :) nite all FB friends! sweet dreams || Each friend represents a world in us, a world possibly not born until they arrive, and it is only by this meeting that a new world is born || got stuck writing my book, listening to staind & Muse lost track of thee Bloody Time! now im stuck in my own little world i have created! || º¤ø¸ø¤Keep the Australia Day Wave Goingº°¨¨°º¤ø ¸ø¤º°¨¨°º¤ø ¸ º¤ø¸ø¤Keep the Australia Day Wave Goingº°¨¨°º¤ø ¸ø¤º°¨¨°º¤ø ¸ º¤ø¸ø¤Keep the Australia Day Wave Goingº°¨¨°º¤ø ¸ø¤º°¨¨°º¤ø ¸Pass It On º¤ø || Go to urbandictionary.com, type in your first name, copy and paste this as your status, and put the first entry for your name under your status || is going to see 2012 tonight woo hoo!!! been waiting to see this, it would be interesting to see if nostradamus predictions come true in 2012!!! || had a good day out, met family from mauritius i didnt know i had, brought amber nearly an entire new wardrobe, bike and other goodies!!! || cant sleep and looking for some inspiration but yet im so tired, i need to finish this chapter! im gonna regret this later today! || is cooking home made chilli, lime and corriander burgers yummm feel like a beer and some poker just no-one to play it with :( || had a really great day at nan howarth's with the whole family yesterday :) now off to nanna and poppi khoo's today YAY :) || YAY *PROPNAME* is fast asleep already!!! that's wat happens wen tarnisha puts toys in her cot wen they are supposed to be sleeping! || In the night garden is not 4 kids!Upsydaisy & igglepiggle kissin in the pinkyponk,tombliboos always strippin,pontipines have 8 kids & maccapacca has OCD! || i really hate spiders just found a heap of massive black ones on the outside of the house i mean MASSIVE :( || i came to win to fight to conquor to thrive, i came to win to survive to prosper i came to FLY || is having pepper steak with baby honey carrots, steamed zuccini, brocolini, eggplant and baby potato's with red wine gravy soooo gooood!!! || off to bed so tired and i cant wait till tomorrow HAPPY BIRTHDAY Ash i love you so so much! xoxoxo || Finally got the net back on!!!! BUTTT left my camera with my funky pics from the w//e in Bendi ): owell! || did some christmas deco shopping and got amber a singing elmo stocking....i so wish i didnt do that now hahaha || is having a bad day why am i so Agro...i think the moon is taking its affect on me already!!! || had a great day shopping got some new dresses and amber new clothes havin a beer and chillaxin now || is bloody tired!!! taking *PROPNAME* to the beach tomorrow :) i even brought her a bucket with spades lol || amber likes Beyonce its funny, everytime i put one of her songs she starts dancing like crazy and singing || *PROPNAME* decided it would be good fun to spill noodles all over her and all over the floor! || its friggin hot and it will be like this till moday arrrggghhh so sleepin in the loungeroom 2nite! || WHERE THE HELL IS DANI WATSON???? i need my purse back i have to go grocery shopping GRRRRRRrrrrrr || Never pretend to a love which you do not actually feel, for love is not ours to command. || is about to start reading my new book~library of the dead by glenn cooper seems very interesting :) || it has been a very interesting day so far.....havin a ball!!!!! poor sandy nearly got hit by lightening || just finished my house duties now going to have a cuppa and chill back with my little girl || heading home in a minute then off to look at bikes for bee's birthday in the morning! || Getting my tattoo drawn up today! so excited, mite get a peircing while im out and about! || amber decided it would be fun to steal an egg and smash it on the carpet ): || my sketch is getting done and im off to get my first tatt next monday wooo hoo || and ash have been outside cleaning the yard and making a rabbit hut for amber :) || wants to plan a kid city day for the little ones next month who is interested??? || wants ash to get his butt out of bed so we can go and do something!!! || just made the best citrus cous cous salad for tea with pumpkin and potato croquettes yumm || is headin to bed in a min, im so tired tonight! wonder what tomorrow brings :)",low,high,high,low,high,01101
504862f12f8c000ae4358a10d657e8f5,"Merry Christmas..Celebrate the day with ur family, wine nd cake.... nd Christians, go to church...lastly, thanks to my buddy who msgd me xactly at the stroke f midnight, i made a jerk out f myself in the church, with evryone staring at me - made my day special..lol!!!! || Wish you all a VERY HAPPY 'Christmas'..enjoy with your family and friend..spread the smile.. Look in your socks in the morning and you ill find a gift - from Him.. Lets spread the Joy nd pray to let peace reign everywhere in the world.. || zynga,i m not able to sent season gifts to anyone via MAFIA..dunno what s the problm....but i keep recievin gifts from my matesm nd i get a bad feelin that i m not returnin the favour...sort t out.. || got back home, cleaned and oiled my gun, armed and ready to take on whoever challenges my reign....nd, i hav not forgotten the 4 possums who beat me in MAFIA while i was away.we'l' deal one by one.... || nd u know, i met a frend of mine who is presently workin for ZYNGA - yes, the same ZYNGA who made MAFIA WARS.... || can someone take care of my mafia, nd my farms while i am away?? i wont take long.. || B-Day Calender is a good appl..u must try it..its simple,user friendly nd moreover,it realy works-i m usin it.. || Holidays comin to an end...Back to action tomorrow.. Wish u all a prosperous year ahead..God Bless !!!! || Unless a miracle happens, life s gonna be a rough ride ahead !!! . . . || reached my 500 limit in MAFIA..and continuing up... a special thanks to all mafia frends... || someone available for 'chat'? its truly boring. mafia wars isnt loading || friends list in mafia is filling up to the limit... || i guess, time is not right . . . || Argentinoosss....Gran juego, mejor de las suertes ! ! ! || Life is so dull without the element of surprise || 5inte paisa polum enta kayyil illa....appola 'treat' || anyone has an extra concealable camera?? || Waiting for 'THE CALL OF DUTY' || Yawn, Feels like . . .",high,low,high,high,high,10111
521896b01c1a506dc4404e600fa99c5b,"I don't want to miss this weekend, but i might have to.... shitty weather and my hubby can't work today.... I think I might cry cause I really, REALLY wanted to go..... why did I ask for snow? I only wanted a little! || I think my part of the RP forum is done... we will need some moderators so anyone interested please send a meassage to me on here and I will get you set up with an account and send a linky.... thanks! || The siren in Reedsburg keeps going off. It's not the normal noonblast siren, it sounds like an air-raid siren and continued for 10 minutes. Can anyone tell me how to find out what the damn things mean? || just woke up to half an inch of snow and is so happy, she's going outside in her pajamas to sweep it off her porch! That's no sarcasm folks..... I'm really excited. :) 5 days! || 6 more days.... I'm counting down! And bah on all you snow-haters. All I know is I don't have to shovel this year, thanks to my loving hubby. Thank you hubby :) || bought her 2010 Farmer's Almanac today.... horray for not having to write down every single sunrise, sunset, moonrise, moonset, and void of course pattern for next year! wOOt! || It never fails... I go to lay my son down for a nap and someone inevitably begins pounding on something, making it impossible for him to sleep. || was NOT able to push her wedding date back to the fourth of September. The presiding judge was full-up. The date remains August 28th at 4:15. || is sick and tired of people who comment on every SINGLE status update, no matter how INSIGNIFICANT. We've been here before, you know who you are. || is thinking that the poor girls doing that ""single ladies"" are getting dissed too much. I've seen younger girls doing lewder dances with less clothes. Seriously. || doesn't want every status commented on. once in a while is fine but EVERY status? It's starting to get annoying. You know who you are. || To celebrate Valentine's Day, change your  profile picture to you and your spouse//significant other, and make sure  to tell how long you've been together! || going to be another long and boring week. So glad i don't have to go anywhere for a few months after this weekend. || finally found out who got her hubby and kid sick... and is pissed that she didn't find out until her son started puking. || work on the forum is done for today..... now time to get lunch for me, connor and the baby and watch Wall-E again..... || is a little upset about the amount of snow, and hopes she gets enough birthday money to visit her parents this weekend. || I should have gone to bed earlier than 1:30 am..... guess I forgot that *PROPNAME* was going to be up at 7.... || doesn't know how to cope with all of this stress... I think I've cried about 10 times in the last 3 days... || Tommorrow, I turn 21. I'm super excited. And I can't wait for 4 pm to roll around..... Mercer, here I come! || is sick.....still. And possibly jobless in 2 weeks. That is, if no more positions open up for me at Wal-mart. || 4 days folks, then up to mercer with my son and my loving hubby. I love you, hubby :) || new profile image..... and the funny thing is, now that i think about... *PROPNAME* IS a lot like *PROPNAME*..... || is drowsy still... at least I managed to get 8 hours of sleep last night... a rarity these days. || still getting over that cold from last week.... but hey at least everyone's laid off the ""quit smoking!"" bit.... || is a little upset about not being able to get a good connection all day. I'll try again tonight.... || stayed home from work to take care of her hubby. By the way, the yorkie babies are so ADORABLE! || Sends out yuletide greetings to all her friends! I love you all and have a very merry holiday! || knows what connor got from her.... he is such a little drama king, screaming bloody murder at time-outs! || found out The Used put out a new album this past year. How did I miss that one? || PANTS ON THE GROUND! PANTS ON THE GROUND! LOOKING LIKE A FOOL WITH YOUR PANTS ON THE GROUND! || smells justice has been served. What goes around comes around, and it definately came around for you, *PROPNAME*! || wonders if its just coincidence that mine and my best friend's birthdays are EXACTLY twoo weeks apart. || is waiting for August 28th at 4:15. Horray for the beginning of the rest of my life! || Wishes she could post her awesome playlist to gaia but can't figure out the coding for it. || Thank you everyone for the birthday wishes and the cards. You guys made last week special. :) || hopes that wal-mart hires her, now realizing her blouse was open during part of the interview. || wishes vampire wars didn't take so long to put monies and energy back to your character. || is at home on her first scheduled day off. And I'm bored out of my mind. || well, my kid and *PROPNAME* are better now..... just waiting for it to hit me... || I am the eggman, they are the eggman, I am the walrus! Coo Coo Cachu! || is eating stroganoff, waiting for her hubby to come home and then maybe some sleep. || needs someone to drink for her on Dec. 12th since I'm pregnant and can't... lol || Hopes no one else bought a baby book for *PROPNAME*... I'm up to three now! || Going to grandma b's for dinner, then to sheboygan falls tomorrow... .what a busy weekend || Well, Reedsburg certainly has an interesting way of plowing the streets..... 2 more days. || More walls! More floors! I need to make the sims 2 even more amazing!!!! || can finally be on the net at the same time as her husband.... hooray! || Finally! Snow in Reedsburg. I'm so happy there's gonna be snow on my birthday! || would work a spell if not for the moon being void of course... || ugh... i hate this. Why is sleep such an issue when you're pregnant?",high,high,high,low,high,11101
526ac2635cb3f5e0ee5d7424e83e9107,"""I've always loved the flirtatious tango of consonants and vowels, the sturdy dependability of nouns and capricious whimsy of verbs, the strutting pageantry of the adjective and the flitting evanescence of the adverb, all kept safe and orderly by those re || No one in ZOMBIELAND should die because they cannot afford a chainsaw, and no one should go broke because they get bit. If you agree, please post this as your status for the rest of the day. || No one should die because they cannot afford health care, and no one should go broke because they get sick. If you agree, please post this as your status for the rest of the day. || ""We know nothing about their language, their history or what they look like. But we can assume this: they stand for everything we don't stand for. Also they told me you guys look like dorks!"" || ""I think of myself as an intelligent, sensitive human being with the soul of a clown which always forces me to blow it at the most important moments."" || And sweating like demons they scream through our speakers But we leave the sound on 'cause silence is harder || You would think by now I would have learned to not answer the door, when Insomnia knocks || Being drunk is a good disguise. I drink so I can talk to assholes. This includes me. || If there's no one beside you when your soul embarks. Then I'll follow you into the dark || want's to have my cake and eat it too.  Also, a prize hidden in the center. || Sometimes I think a Busou Renkin cosplay would be hilarious, then I stop and remember Papillon || All Hail the king of dunces. You best hold on I am opening up my mouth || Sweet tendrils grasp at my breath. Enticing wisps of freedom.  Euphoria escapes in an exhalation || Like a madman laughing at the rain. A little out of touch, a little insane || ""Thoughts meander like a restless wind inside a letter box, they tumble blindly as ..."" || If anyone is going to be on campus, please contact me (Preferably by text). || Back into playing DDO.  Anyone interested in joining in hit me up on aim || Was not aware of the streaming video at the ECA meeting last night.... || Even at such a young age, I understood the weight of the World || ""On the Radio"" is playing on the radio.  *insert ever so slight chuckle* || Does my insomnia breed mania or does my mania quell my fatigue? || - I would really enjoy a Limit Break of the valorous nature || I am a somewhat Dark//Morbid Individual, and yet Nana makes me cringe... || As a side note: this is some Delicious Mac & Cheese! || has to wonder if West Allis is still manufacturing bomb parts || Sleeping children fear not for the Sun brings a new day || From Anomynous: ""These vampires need to either get naked or die"" || La Dee Dee 1 2 3 *PROPNAME* the Half a Bee || There be a baker's dozen of Turkeys in my backyard || ""Really? You have to remind yourself to raise American Spirits?"" || Looking for the light at the end of the tunnel || I have to admit SWtOR has one awesome trailer || ""You can't blame Mad Scientists for doing mad science"" || I think I just dreamt about trade and commerce... || ""The Queen says no to pot smoking FBI members"" || Really do not care for my hyper metabolism || I do not understand my fascination with horoscopes || Only theater in the area is in Chicago.... || I think I need a new Spirit Animal || Lets make the most of this Year || Anyone participating in Allods Online Closed Beta? || Still need to see Across the Universe || is a Fool but also a Dreamer || And now I am covered in glitter... || I think I need a new MMO... || This cat will not leave me alone... || ""I have a $1.57 and a nickel"" || Fear and panic in the air || can't wait for the ex x-box || Can't Sleep, clown will eat me",low,low,low,high,high,00011
