author_id,text,cEXT,cNEU,cAGR,cCON,cOPN,label
c85845b82e705a32f674757d8912df23,"doesn't know what to make of the fact that based on my interest in TV shows like ""Brotherhood"" and ""Californication"" , Netflix has a recommendations section of other ""Dysfunctional family dramas""  This includes ""Dexter"" and ""Rescue Me"" which are both shows I watch. Oh Netflix you know me so well. || Funny: Every time I have to spell a word over the phone using 'as in' examples, I will undoubtedly draw a blank and sound like a complete idiot. Today I had to spell my boss's last name to an attorney and said ""Yes that's G as in...(10 second lapse)..ummm...Goonies"" || The feminine version of the name *PROPNAME* meaning ""the woman."" Basically never printed on magnets, mugs or other souvenir paraphernalia. Often mistaken for *PROPNAME*, *PROPNAME*, *PROPNAME*, *PROPNAME* or *PROPNAME*. My name is *PROPNAME*, not *PROPNAME*, dammit. (Urbandictionary.com, type in your first name, copy and paste the first entry) || is happy to have a new working DirecTV box. I can open the guide and switch channels without it freezing....and the DVR works. I can now go back to waiting until a few minutes into a show before I start watching and then fast forward through commercials! || doesn't think the changes to facebook were really needed but honestly I'm more annoyed with all the complaints I've seen about it. You get it for free so if that means every once in a while you have to deal with a new layout well...deal with it!:) || Dear Louisiana Office of Motor Vehicles employees, I understand that you probably get stuck dealing with stupid, annoying people on a regular basis.  That doesn't mean you have to be rude to everyone, especially not the friendly people like me darn it! || is wondering what the heck? Last week my computer hard drive died and just a few minutes ago I got the blue screen of death from my DirecTV box saying a problem has been detected on my hard drive. Not cool. || was enjoying my morning shower until one of those stupid Saints remixes came on the radio. I'm all for that kind of thing when I actually go to games, but I'm sick of hearing it in regular rotation on the radio. || off to the store to get the things I need to make caramel apple cookies. I hope that mine turn out as good as the picture! I also hope that they have the caramel bits I need at this Walmart! || is wondering how many people get themselves screwed out of money by not paying attention and keeping records of stuff. I just added another $70 to my ""um no dumby actually I don't owe you that money"" total. Yay me:) || is feeling productive after posting *PROPNAME*'s care on autotrader. If anyone is possibly interested in a 2006 Honda Civic Si for ~$13500 let me know. I will post the link too once it's officially up on the site! || is nervous about getting cavities filled for the first time ever tomorrow:( The up side is that it probably isn't as bad as repair work from stepping on a shovel;) There I feel a bit better now! || is off to bed and hoping not to be woken up by things flapping and crashing from the crazy wind outside. On the up side it's going to be in the 60-70 range for the next week!:) || The first 2 Atlantic tropical storms, *PROPNAME* and *PROPNAME*, have formed. I'm not too worried but have to admit there's a little unease about the idea of something making it here. Afterall, this is my first rodeo! || is off to the gym again. I tried and can't think of a valid reason not to go, plus my legs aren't sore are at all from yesterday. I will will thank myself for this later:) || just saw a commercial for Rihanna's 20//20 interview about her ordeal with *PROPNAME*...isn't it convenient that she is finally able to talk about it in an interview aired the day after her new album comes out? || ""You try growing up in a trailer park with nothing but dust mites and Lithuanians and see where that gets you""..a line from a terrible movie on netflix on demand, but it made me giggle || *PROPNAME* brought me breakfast in bed this morning, hanging out with *PROPNAME* later, then a delicious pineapple pork chop dinner made by *PROPNAME* and watching a movie..what a great day it's going to be!:D || For once I meant to let my phone battery die all the way before recharging and did I remember to plug it in once it reached that point? Not until just now...oops || is pretty sure I'm coming down with whatever *PROPNAME* considering I just folded a load of towels and now feel completely drained.  The good news is that the TV is working again:) || is annoyed that GM decided it would be cool to have some stupid ass bracket for wiper blades on the G6 resulting in me having to pay $70 for replacement blades. || Sometimes, I'll watch a movie that I watched when I was younger and suddenly realize I had no idea what the f**k was going on when I first saw it. || is taking *PROPNAME* to the vet for her annual check-up. I know it's good for her I just always feel a bit bad because she hates it so much :( || is trying to decide what to stock the fridge with so there is a chance that *PROPNAME* will eat something besides fast food for 5 days that I'm gone! :) || why oh why do I let myself watch animal cops shows? I just end up feeling a mix of sadness for the animals and almost rage towards the people involved. || is happily watching Pixar short films on abc family while my DVR records *PROPNAME* on another channel:) Oh and I'm drinking my pumpkin spice coffee too! Life is good! || set my calorie goal for wii fit tonight as a piece of fried chicken....turns out it takes a lot of work to burn off a piece of fried chicken! || had a good workout at the gym this afternoon, just took a nice relaxing jacuzzi bath and now off to bed with fresh from the dyer sheets. Ahhhhh fantastic:) || wasn't very impressed with ""Taking of Pelham 123"" although I was amused by *PROPNAME*'s character talking about the girl he took to Iceland..a Lithuanian ass model named Lavitika.  Ha || almost time to make white chicken chili with cheddar jalepeno hushpuppy crust. It's going to be even better than usual 'cause we finally have some fall weather here! || went to see ""The Hangover"" tonight then came home to enjoy a nice relaxing jacuzzi tub bath with a glass of wine...life doesn't get much better than that! || just finished playing wii fit plus and burned an ice cream cone worth of calories. Now it's ok for me to eat an ice cream right? Kidding:) || just finished watching "" Dear Zachary: a letter from a father to his son"". It was a pretty good documentary but very emotional...I suggest having tissues nearby || I like all of the music in my iTunes, except when it's on shuffle, then I like about one in every fifteen songs in my iTunes. || didn't think that coming to take care of the water heater first thing in the morning meant 11...I guess there's still 45 mins until it afternoon! || Bad news: Novocaine is wearing off so my mouth is hurting a bit now. Good news: I can now drink my pumpkin spice latte without dribbling:) || perhaps *PROPNAME* putting off getting our Halloween costumes for so long was really his way of helping me find my awesome costume idea :) || is getting very excited about decorating for Christmas! We are heading out to get a tree and all that fun stuff in a while:) || How many times is it appropriate to say ""What?"" before you just nod and smile because you still didn't hear what they said? || A bit mean...but damn funny Sarchasm : The gulf between the author of  sarcastic wit and the person who doesn't get it. || Happy Thanksgiving everybody! I'm thankful for friends to share Thanksgiving with:) Now time to make some yummy food to share later || had a great day with a wonderful friend and a wonderful evening with a great boyfriend. I'm one lucky girl:) || feels bad for my sick boyfriend. I know he feels really crappy 'cause he's sitting still and not playing videogames! || Fantastic day of hanging out with friends and doing some shopping:) Relaxing on the couch reading for a bit || is watching ""The Proposal"". *PROPNAME* and *PROPNAME*...even if the movie is crap it won't be a total waste:) || Is excited to have 2 more new books from Paperback swap but can't decide what to read now! || just had a wonderful chat with *PROPNAME* on the phone and is about to start making dinner:) || If *PROPNAME* San Diego and *PROPNAME* ever got together, their offspring would probably just be completely invisible. || did an hour long workout and now I'm trying to convince myself to vacuum the house. || accidentally clicked the wrong button on a page. Sorry for sending that farmville thing to everyone!",low,low,high,high,low,00110
c87247ddb57f8d8ff43086ac88e69120,"longest day ever?  Full day in hawaii + red eye flight to LA followed by 15 hours of rehearsal for The Sing-Off.... it's time to SLEEP! || wishes she could give her dog a huge hug right now.  Dog lovers: read ""The Art of Racing in the Rain"" || is speechless from the flowers sitting on my desk.  can't stop smiling.  I honestly don't know how I got so lucky || is back in LA! back at work! back to 75 degrees and sunny!  and yet, missing the single-digit temperatures of chicago.... || in the studio.  listening to amazing musicians record an amazing film score. so proud of my genius composer boyfriend! || Wow, I am blown away by how supportive everyone is!! THANK YOU! 2nd episode tonight at 8 :) || is drinking tea and Emergen-C like it's nobody's business.  I refuse to be sick any longer!! || hey friends! did anyone leave a fake (but extremely real looking) gun in my car? || prefers swimming in Lake Tahoe to staring at it on her computer desktop :) || Tonight! NBC at 8 pm! The Sing-Off is ON and I am freakin excited! || is having a little bit of a post-haircut freak-out. (it's so short!! ah!) || woke up in Chicago :) Happy, healthy, wonderful new year, everyone!! || MAUI. so happy and warm and thankful :) || family in LA! let the restaurant adventures begin! || has a crush on the birthday boy...",high,low,high,high,high,10111
c8a62ce2aa837024b698e3eb72aa3c42,"No one should die because they cannot afford health care, and no one should go broke because they get sick. No one should be unable to change jobs because of a ""pre-existing condition."" If you agree, please post this as your status for the rest of the day. || Please put this on your status if you know someone (or are related to someone) who is gay. My wish for 2010 is that people will understand that being gay is not a disease: people who are gay are not looking for a cure but for ACCEPTANCE. || Now that *PROPNAME* has returned to New York, I am finally working on completing my philosophy of Jewish education paper.  It is pleasant to do school work after two weeks of rest, relaxation, and fun.  :-) || Contemplating the Forms and Plato's utopian society as I write my paper on Plato.  Please note that I do not actually agree with Plato's ideas, but I find them fascinating. || I see the light at the end of the tunnel!  Liturgy take home final due Friday and last but not least, Philosophy of Education paper to complete during Winter Break. || I'm liking my new desktop computer and thankful that it is not giving me any grief thus far.  :-) Shanah Tovah (Happy Jewish New Year)! || I am thankful for webcams.  It is nice to be able to see my fiance online while he is in New York.  :-) || I hate the fact that I currently have no computer.  It is not fun to have to borrow other people's computers. || I hate having laryngitis as a songleader.  I want to be able to do my job, but I can't.  :-( || Lesson planning and creating a calendar for the school year... hard to believe I will be teaching already on Sunday. || I'm so excited about my upcoming trip to New York!  :-)  I leave Thursday night on a red eye. || To all my Jewish friends: Gemar chatimah tovah.- May your final sealing (in the Book of Life) be good. || is hoping that everyone who fasted for Yom Kippur had an easy fast and a meaningful prayer experience. || Two more weeks left of camp.  Looking forward to seeing *PROPNAME* on the Roof on Sunday, August 9th! || ""This is the day, come what may I'll still be saying this is the day."" Loving camp!  :-) || I've officially booked an October flight to New York to visit my future husband.  :-) || Enjoyed spending the weekend with my love.  Now it is back to the grind. || Can't wait until Friday morning when I'll be in my fiance's arms.  :-) || I am getting less and less sleep due to midterms.  :-( || Thank goodness my voice is back.  :-)  Shabbat Shalom everyone! || *PROPNAME* and I are engaged!  :-)  I'm so happy. || Thanks for all the mazal tovs // congratulations.  :-)",low,low,high,high,high,00111
cce9e48f159ae910f38fb00810be2a68,"A recent online exchange: Other guy: ""I have to imagine it's wholly possible that someone could understand humans so well, yet be completely unable to read, write, or do math.  In today's society, people like that would be shunned.  Veritas If you can't r || ""And we keep driving into the night.  It's a late goodbye, such a late goodbye.  And we keep driving into the night.  It's a late goodbye-ai-ai-yai."" Staying overnight somewhere east of Toledo.  Wonder how bad I-80 will be tomorrow. || 3-hour exam tomorrow, then a day and a half (less if I drop into New York Wednesday) to pack EVERYTHING before driving out Thursday to reach Iowa on Friday.  Someone tell me I'm not insane, please. || Recidivism (n.) - 1. Committing new offenses after being punished for a crime.  2.  Chronic repetition of criminal or other antisocial behavior. Replace ""criminal"" with ""stupid"", and I think I've found my problem. || s wireless internet keeps spazzing out every five minutes.  It's really annoying.  Actually, it's more than annoying, but I haven't gotten angry enough to start using foul language. || ""40 years ago, Armstrong said 'One Small Step for Man'.  When can one of us go back there and shout, 'Honey, I'm home!' or something?"" || Woo-hoo!  On to Indy!  Anyone care to place an over//under on how long it'll take for some sportswriter to mention Namath or Super Bowl III? || Last night pretty much sums up my entire UChicago experience.  I don't regret going.  I regret screwing up the decisions made while there. || is going to go on a 1000 mile trip to Iowa City tomorrow and Friday.  This is going to be a long drive. || Whoa, OK, that was more emo than I had intended.  Sorry to get you guys worried.  Full details upcoming. || wishes he had an actual bed (or even a mattress).  It'd make dealing with these suspiciously-flu-like symptoms easier. || lit his fried chicken on fire and now has more stuff to clean.  Great. || is in Chicago for Uchi-con.  And somehow got stuck watching a game room AGAIN. || has found the U of Iowa anime club.  There goes my GPA. || will have a miracle if he gets an 80 on today's midterm. || has just finished his first night at reffing.  Much to improve on. || hopes the geo-pol forum-based game doesn't get him perma-banned from Japan. || has arrived at Iowa and is settling into his new apartment. || Curse you, UCJAS!!  Now I'm hooked on *PROPNAME*!!  *shakes fist* || Did the President just make a reference to the Matrix?! || ""The King of Pop is dead, long live the, uh..."" || has no more finals.  But it keeps going uphill. || is trying to change.  Long overdue, I suppose. || is putting the touches on his Halloween costume. || has learned nothing from 20 years of school. || My hat is off for the Colts. || is watching the Little League World Series. || has been accepted into grad school.  Finally. || is in Ottawa.  Illinois, not Canada. || passed his F//M exam.  Huzzah! || ""Holy Haruhi, season 2's out?!""",low,high,low,low,low,01000
cd99c28741e42fd9792616d3a4328f17,"""and a britney song was on, and the britney song was on, and the britney song was on! so I put my hands up, they're playin my song, And the butterflys fly away, Noddin my head like yeah, Moving my hips like yeah"" ~ oh yes, i went there! || I find it odd that we're all just chillin on top of these massive plates floating on crazy hot elements that collide and shift. and all the while we stress these teeny tiny things...that's a pretty big picture! may god bless the people in haiti! || i believe i can fly! woo! i believe i can touch the sky! think about it every night and day, spread my wings and fly away! i realllllly need something to do right now! lol || not to be a bitch but...if i hear about one more celeb dying from drug overdose i'm going to fing lose it...get it together and act like adults...ridic || ugh...in a class with mostly 18 year olds, cursing myself for not taking com 1 my freshman year when i could've copied off of someone! damn it...lol || ""it's raining, it's pouring, my whole life is boring, because of yooouuuuuu!"" - if anyone beside weezie can name this quote i will be plesantly surprised || *PROPNAME*: So... Saturday night, the big night. Date night. Saturday night, Sa-tur-day night! *PROPNAME*: No plans, huh? *PROPNAME*: Not a one. ~~HA HA HA HA HA! || trying something a little different...bringing in the new yar sober, hopefully it will be a reflection of the year to come! XOXO || oh time for little anna nicole to take a bath...i love when her little face gets more ""concern"" wrinkles! too cute! || Today is an off day... thank goodness it's almost over! maybe some gym time at around 7:30 or 8? anyone... anyone? || being where I'm from, agricultural labor should be much more interesting to me...but, ughhhhhhhh! definately narrowing down potential career paths! || we've all done things that we are ashamed of...if anyone saw kanye on leno tonight well...he's not sooooo bad. :-) || most of my eyecandy is gone...time for a new gym! p.s. lost my phone! holler at me on here! || mom: ""so you're playing hard to get? me: ""who's playin, I am hard to get!"" LOL LOL LOL || oh yes its ladies night, and the feelins right! oh yes its ladies night, oh what a night... || why does everyone think the rain is time to play or walk extremely slow with their heads down....WTF! || skipped the gym today, but is willing to make up for it by dancing!! going to mix! WOO || note to self...do not eat curvy pickles...they will squirt you in the eye when bitten into too feverishly! || BEST TUESDAY EVER!!! done with dmv, getting my diploma in march, and getting off prob. early!!! YAY! || is getting ready to get crunk and party like its 1999! holla at a playa! LOL || my hangover + klonopin + gresy ass breakfast = festive events in me bed! :-) || s toenails look neon in the sun, but grungie in the shade...don't get yellow! LOL || 1 pot of coffee + very little sleep = a spastic delirious pammy! wee || back to school, back to school, prove to dad i'm not a fool... || just realized how much she missed all the girls! love you guys! XOXO || gonna go try bikram yoga for the first time! this should be interesting! || is waiting for the progressive man wishing she were at the gym! :-( || i wish it was summer, i want to go on a boat. || why do i choose to embarrass myself every chance I get? ugh. || is shocked at her grades, not as bad as I thought! || just saw a flash of channy's face on a commercial! YAY! || looking like this is going to be another sleepless night...dang it || wishing away my weekend so I can watch Monday night football! || getting ready to stalk taylor marsh...any hints would be helpful! LOL || ummm...ouch...cool cousins christmas makes me worthless once again! best tradition ever! || suggests everyone see harry potter and bruno! both great movies!!! || ok...2 assignments and a midterm...then let the festivities begin! YAYYYYY! || is trying to find a movie to wath online...any suggestions?? || Please fill out my survey at CA *PROPNAME* Survey Group! || should be studying but is being naughty! tisk tisk! LOL || oh sweet sweet monday, you treated me so well... || i got that boom boom pow! lol lol lol! || is sooo sick of douche bags! kick rocks bitches!!!!! || is sooooo excited to see Mu Sochua speak today!!! || ready for a new day after a disappointing evening! || I am officially addicted to twilight! books and all! || Out in Sacramento tonight! Starting at Badlands! WOO HOO! || is warm and blood free...oh sweet sweet life! lol || what is everyone doing tonight?? i'm so bored..... || new year...maybe some new hair...i'm thinking chocolatie brown!",high,low,low,low,low,10000
cde9ad52e50a6a9740dcb3461deb8a0b,"If you & I woke up in jail together...using only FOUR words...what would you say to me? Copy and paste this in your status and see what funny things your friends say....(And if you make a comment, you gotta put this in your status. Fair is fair.) || Really?  Two days in a row?  I would like to take back my comment about de ja vu - I didn't mean I wanted it to end like that (again). || It'a kinda like de ja vu - working at home, wathcing the *PROPNAME* (Steelers) game, and snow is still on the ground.  Good thing I know its Sunday! || CCHS Jv - you girls rock!  what else can I say?  And mega shout-out to *PROPNAME* for moral support  tonight and rockin' programs. || Anyone in the pitttsburgh area able to work the polls on tuesday?  I've got a friend that needs help.  Let me know.  Thanks. || Wow, that was a great game - even if *PROPNAME* did lose. Hope the 1 v. 2 game tonight is that good. || preparing for tryouts and the start of Steelers season . . . its that time of year again! || Working at home, wathcing the *PROPNAME* game, and watching the snow.  The words ""lazy Saturday"" come to mind. || at work on a sunday - but at least the steelers won last night! || If I ruled the world . . . imagine that . . . || Yea CCHS JV - starting off the season with a WIN! || I have the best boyfriend ever.  Thanks babe, I love you! || Lazy day around the house after the family has left. || How does that kind of fallen even happen that quickly? || And yes, I misspelled ""watching"" not once, but twice. || here we go, steelers, here we go! || absence sharpens love, presence stregthens it",high,low,high,high,high,10111
ce1a957dabf068478d322a56c0dfaf41,"loves being back in the Mid Atlantic and in high school where 2 hour delays for 3 inches of snow are possible! || just booked her tickets to Germany for Winter Break (!!) and is heading to Ithaca tomorrow for Homecoming! Life is good :-) || ""I gave her my heart and she gave me a picture of me as an old time sheriff."" || is heading to Princeton to watch the little bro row in his first race! Go Big Red! || made the most kickass shrimp penne arribiata-like dish! Now, off to watch the game! || is venturing off into the world of high school football. Go Lions? || wants it to be 1 month and 2 weeks from now. || BEST DISCOVERY: There is a Wegman's 10 minutes from my house!! || is getting ready to wrap up her first week in NYC. || Longest day ever--but so great to see so many HC people! || is checking out what Habitat for Humanity is all about! || Last day of school until the New Year!! (3 days!) || is tea at lunch and pumpkin bread muffins after school. || is back in DE for the Dover race tomorrow! || NYC to incommunicado in 24 hours? Can't wait :-) || Back States' Side :-( What a wonderful trip :-) || is making apple-carrot muffins like no one's business. || vegetarian chili and beans for the little ones || will be in NYC by this time tomorrow! || is off to her first day of school! || RIP Raccoon in my driveway this morning :-( || s house smells like hickory and fall! || is really missing 130 Linden right now. || just needs to make it through Thursday. || is Delaware-bound in just a few hours! || can't wait for Ithaca tomorrow :-) || just made some kickass veggie lasagna! || is all about NYC tomorrow :-) || so there's a Guam quarter? || cannot wait for Friday! :-) || what's up PA inspection standards?",high,low,high,high,low,10110
ce9e978af8369a85f4fc15137013015b,"geneva....geneva... geneva - you should just pay for a  bus ticket back to nyc... || Driving down Mosel to Luxembourg! Then catching the early bird tomo to Baaar-the-looona yippee || Hoping it's not gonna rain today... or... in the next week... or... ever. || Thanks for all the birthday wishes and Madison Beach 6:30. Everything's casual. || then second - can i make things worse than it already is? || Dr. Horrible Blog, reminds me of the themes in Wicked. sooo goood. || is stoked about this weekend. Marble Canyons: here we come! || Excited about *PROPNAME*'s awesome pics from yesterday;) || Thanks for all the birthday wishes! || AHHHHH!!!! The best surprise ever! || In Barcelona - simply amazing",low,low,high,high,high,00111
cef8086fc8220dde9874948728787a2c,"it needs to be sunny so I can invite a bunch of peeps over || I have never changed my facebook pic ever, that should be a record right?",low,low,high,low,low,00100
