author_id,text,cEXT,cNEU,cAGR,cCON,cOPN,label
8de8bd927b7382cb4fa28b96d9c1d539,"What the fuck! Pas de dossier criminelle pour ne pas nuire à sa carrière aux État-Unis!!! Wow bravo la justice.... Encore un autre trou de cul qui s'en sort les mains clean pour ce qu'il a fait!!! En passant, *PROPNAME*, bonne carrière aux States!!!! || *PROPNAME*, t'es une belle ordure!!!! Selon moi, t'as sanction.... T'ES BANI DE LA  LHJMQ!!!! Tu mérite juste ça toi pis les autres estie de cave de ton genre!!!!!!! Merci de salir l'image du hockey sur la scène nationale mais aussi internationale! || *PROPNAME* est en feu!!!!! Je me demande c'est qui le prochain sur la liste..... Mais il y a toujours un gros problème.... Le centre #1 C'est qui au juste????? Pis c'est qui le nouveau gardien d'expérience pour seconder *PROPNAME*???? || Encore un autre incident dans le hockey qui salit laréputation, j'pense que je vais commencer à m'intéresser au hockey olympique à la place étant donné qu'il a plus de respect dans le hockey professionnel || SELF ESTEEM: Far too many people have no idea what they can do 'cause all they have been told is what they can't do! || Et un autre de partie..... Juste une question qui me trotte, on joue avec une équipe incomplète maintenant, on est supposé faire quoi là? || La grande question maintenant.... Est-ce que le CH est une meilleure équipe sans *PROPNAME*.... Le 1er test d'une longue série: Samedi VS Les Rangers... || It is the will of the leader to lead, not to follow! He must not guess what he must do, he must ''Know'' || Ma résolution de 2010: ADOPTER UN MEILLEUR STYLE DE VIE! J'pense que ça à de l'allure comme résolution... qu'en penser vous? || En train de faire son choix de cours pour l'école... tant de programme et de possibilité, c'est vraiment pas cool ça!!!! || ""Those         who say it cannot be done should not interfere with those of us who are doing         it""© -             *PROPNAME* || The world lost a great one!!!! We will never forget!!! RIP and party hard with Elvis and James Brown!!!! || WOW méchant accident à la job, un char de police qui passe à travers une porte de métro!!!! Mourant!!! || Google WAVE IS THE SHIT!!!! just started looking threw it and I want now more then ever a Blackberry!!! || Le CH qui bat Washington.....  Une chance qu'OVI était pas dedans car il dominait la zone offensive complèment! || Pas pire, rendez-vous pour un orthopédiste, 2 semaines nice! J'm'attendais à attendre l'année du rat! lol || The Wings tonight and they're on a bad beat!!! Better not choke, we're on a momemtum! || And the bomb is out: KOVI IS A SENS NOW!!!!!!! OH MY GOD!!!! I'LL MISS MAN! || According to ancient budhist priest, when the student is ready, the teacher will appear (Being *PROPNAME*) || J'ai le pied en feu! Bottle training Level 1 & 2 complete.... Now: LEVEL 3 :( || Dernier 72 hrs de gâterie et on commence le ''vrai training'' J'ai déjà mal! lol || Start slow.. Step by step.. Do what you can and the results will follow -*PROPNAME*. || Training Feels good! 208.4lbs less then 10lbs and I've reach my weight goal! Nice!!! || Pas de mauvaise nouvelle pour l'instant! Je présume donc que c'est une bonne chose! || 9//11 I still remember what I was doing, doying a delivery at Place *PROPNAME*!!!1 || less then 24 hrs and it's christmas!!! I can finally unwrap my gift! || LE RETOUR DU ''CENTRE MOLSON''!!! On commence à savoir ou on s'en va! || Je pense que je suis en amour... avec une 370Z! J'en veux une!!!! || 6-0 les gars était enragé!!! Fais du bien voir ça des fois! || L'été est fini.... et je commençais à me faire du fun!!!! || Samedi soir et on se croirais Lundi tellement que c'est plate!!!!! || 2 jours encore et fini le training à la place dupuis! || Last days of freedom them back to where I left off... || Oh my god!!!! THE AE86 is coming back!!! Fusion subaru//toyota sick!!!! || New job, New opportunities and also a new training coming soon!!!! || going to see my new school tomorrow if everything goes well!!! || Nouveau contrat en fonction lundi: Controlleur Place Dupuis! Ya baby!!! || My foot is killing me but what a nice ride!!!!! || Pourquoi il pleut chaque fois que je sort mes blades!!!!!!! || OH HELL YEAH 205.6lbs!!!!! 5lbs et j'ai atteint mon objectif!!!! || 24 hrs de congé, ça fais du bien quand même!!!! || La pire Grey cup que j'ai vu à date!!! || is this how it's going to be? For real..... || Schumi is back next year with Mercedes-Benz!!!!!!! SICKKKKKKKKKKKKKKKKKKKKKKKKKK || WHAT!!!!! PHANEUF ET GIGUÈRE AVEC LES LEAFS!!!! || Oh WHAT!!!!! LATENDRESSE EST ÉCHANGÉ AUX WILD!!!!!! || Bergeron qui  nous fais un Fosberg!!!! Débile || What's going to happen this week-end? || It was actually summer today! Cool! || SUPER BOWL!!!! SUPER BOWL!!!!! SUPER BOWL!!!!!!",low,low,low,low,high,00001
8e228453cfa66cf26d56af6df77624b7,"H1N1= :| ...  :{  ...  :(  ...  :@...  oink oink *PROPNAME*, ""So the Swine flu vaccinations are on shortage til Dec....How come we we never seem to be on shortage for illegal drugs like crystal meth or coke???.... We should hire those guys to make the H1N1 vaccinations..."" || ""So the Swine flu vaccinations are on shortage til Dec....How come we we never seem to be on shortage for illegal drugs like crystal meth or coke???.... We should hire those guys to make the H1N1 vaccinations...""- jay leno || DON'T TAKE UGLY BETTY off the air!!! There are plenty of stupid shows on the air ...this is one of the FEW SHOWS that's actually EMPOWERING TO WOMEN and SPEAKS TO REAL PEOPLE! || *PROPNAME*'s sons' new car-$360,000  *PROPNAME*'s new ring- $800,000 The Average cost of a 16yrs bday party in West LA- $275,000 (Quotes from NPR) PEOPLE GET IN TOUCH WITH REALITY AND SHARE!!! || So UC Tuition Fees are increasing by 30% and the salary of the UC Regents has been increasing since our fee hikes....SO THAT's where all of our tuition money is going... || The New England Journal of Medicine reports that 9 out of 10 doctors agree that 1 out of 10 doctors is an idiot.""~ *PROPNAME* || I'm sooo lucky to have such good friends and family! Thanks for all the sweet bday messages! Lots of love to you all! || Proud of the success of her BSP family members!...Congrats to everyone who got into Med School, Dental School, and Grad School!...Best of Luck! || Graduation Pictures Are STUPID Expensive...So just buy 1 of the smallest pictures and then copy them later...IT IS WAY CHEAPER..... || GO BEARS!!! VERY VERY PROUD TO BE BERKELEY ALUMNI!!! Go BEARS!!... Oh Stanford...you're just never good enough... :( || Happy Lunar Year! I hope it is filled with good health and happiness...and lots of red envelopes! :) || Here's something to think about: How come you never see a headline like 'Psychic Wins Lottery'?~ *PROPNAME* || ""OMG...The new SIMS is soooo cool...You can even make friends and stuff...""- my very lonely friend... || Best Weekend...Eating with family and movie nites with the little cousin... :) :) :) || ""Hey don't smoke that Tijuana it'll make you crazy,"" my grandma... hehehhe :) || I have the best adhi in the whole world...and I HATE physics... || GO Bears! Very Proud to BE BERKELEY ALUMNI! GO BEARS! || I have the best adhi in the whole world :) || Hamro Bai haru laai... bhai tikako dherai dherai subhakaamana....:) || ""Happy Non-Denominational Happy Winter...""  Just kidding... Happy Holidays Everyone... || Happy Dashain! Dashain ko Subhakamana Sabaai laai! :) || I wanna get two bunnies....They are sooo cute.... || I want two BUNNIES...THEY ARE SOOOOOO CUTE:) || Dashain ko Subhakaamana sabaai laai!!!Happy Dashain!!! || PHYSICS= BAD.  My Favorite Equation.",high,low,high,high,low,10110
8f9d4ed5d16ed1a67d734196d29d1f6b,"4 publications in 10 years, yo I can divide// That's one every let's say two, two of them shits was due// One was - NAHHH, the other was in the Journal of Mathematics// That's a one hot publication every ten year average// And that's so - LAAAAAAAME! || In KABUUUUUUUUUUL! Desert city bringin down empires There's nothin we can do  Now we're in KABUUUUUUUUUUUUL! The streets will make you feel so screwed No hope cuz we're all doomed Let's here it for KABUL, KABUL, KABUUUUUUUL! || Will someone PLEASE explain to me why everyone thinks *PROPNAME* is so awesome?  I mean if you put *PROPNAME*, *PROPNAME*, or *PROPNAME* on all of my songs, they would sound just as good, if not better. || Today at the gym I saw on TV that Michael Jackson was dead.  I was so shook up I couldn't keep working out.  Also, I will do anything to skip dumbell lifts.  They really suck. || *PROPNAME* wrote that ""pure democracy"" doesn't work because ""there is nothing to check... an obnoxious individual."" Then, in the margins, he doodled a picture of *PROPNAME* the Plumber. || After 3 tracks of Illmatic in the car today, my grandma turns to me and says ""Turn off this noise and put on Michael Jackson!""  Priceless || And finally, thanks to capitalism, the curse of bin Laden is broken.  GO YANKEES!  Now let's rebuild those towers and get out of Afghanistan. || Actually most people on Twitter are old Republicans who don't know how to use Facebook or who are morally opposed to ""poking"" strangers. || Does anyone know where I can find the firefighter's test from the *PROPNAME* case that is causing *PROPNAME* so much consternation. || This year for Eid I want to see my Muslim president on all the morning talk shows at once. || Me, I'm doin business and no one ain't ever seen us//  If Jay-Z payin' *PROPNAME*, Im payin *PROPNAME* || ""Why is America like Michael Jackson?  Both achieved their peaks with a moonwalk performed decades ago"" ~ *PROPNAME* || Only engineer to rewrite history without a pen// No RFID on my Mac, let the story begin....begin...begin || will boycott any sponsor pulling their Tiger Woods advertising.  Gillette, Gatorade, you've been put on notice. || Off to see whats left of the Beach Boys (I go white one day a year) || Get around round round I get around Still down with the Underground When I come around || Im serious, I have an extra ticket for the MJ funeral.  Who wants to go? || I will show you *PROPNAME*'s birth certificate when you show me *PROPNAME*'s high school diploma. || will not be compromised by some puny prodigal pathetic pitiful pusillanimous putrid punk from Bangladesh || Im sort of half expecting MJ to come dancing out of the hospital singing Thriller || Cant a man enjoy his Nobel Peace Prize for a day?  Just for a DAY!? || And now it is time for the Yankees to break the curse of bin Laden. || ""Im going to University of Maryland, but I spent the summer at HARVARD."" ~ Adweeb || Ok, who wants to go to LA with me Tuesday for the MJ memorial service? || will NOT under any circumstances attend a Spring Weekend concert headlined by Dashboard Confessional. || My personality spans, too numerous  A gentleman, intelligent, athletic, a thug and I'm humorous || One is apt to overestimate beauty when it is rare ~ *PROPNAME* || *PROPNAME* is going to NY for her next concert on Nov. 22nd || *PROPNAME*, *PROPNAME*, and *PROPNAME*: 3 great men doing great things in 2009. || ""I don't have to explain anything to you solecistic amoebas"" ~ *PROPNAME* || Flight delayed 2 hrs , but Orlando Intl Airport has free wireless! || Senator *PROPNAME* reminds me of Senator *PROPNAME*, but considerably more treacherous. || Dunk contest was lame this year.  Everything the Knicks touch dies. || BET Awards Sunday at 8.  I will not forget this year. || could only gaze on *PROPNAME* from afar today at Disney World:( || *PROPNAME* was not as cool as I thought he would be. || has just finished watching the Wire, and it was awesome. || Forgive me for what I am about to do tonight. || Can Obama will the US to victory over Brazil Sunday? || Jay-Z in a tux at the American Music Awards... Priceless || It's all about control and if you can take it. || Ugggh, why did I eat those donuts?  Never again! || Forget fireworks, I want to see the *PROPNAME* funeral. || Nothin's equivalent to a New York state of mind. || *PROPNAME* should have thanked *PROPNAME* in her Grammy speech || Ok change of plans again, and back to Gekko. || Greed, for lack of a better word, is gy. || There are too many imitation *PROPNAME*'s on Facebook. || In 2 years went from *PROPNAME* to *PROPNAME*... || I need the wisdom of a wise Latina.",high,low,high,high,high,10111
906314c683222f7d232b5ea1ee82befc,"During a recent password audit, it was found that a blonde was using the following password: MickeyMinniePlutoHueyLouieDeweyDonaldGoofySacramento. When asked why such a long password, she said she was told that it had to be at least 8 characters long and include at least one capital. || I have hardly given more information in the octameter,heptameter, hexameter, or pentameter than there is in the tetrameter- of course the boys are sleeping, you can't wake someone who isn't and a very roof is still a roof.  ""The Ode Less Travelled."" *PROPNAME* || For those of you who are just 6-7 hours away from 2010, Happy New Year//nuovo anno felice//nouvelle année heureuse etc., and for the rest of us, whether on the east or west coast, I hope it will be worth the wait :) || Happy Chinese New Year! To all my fellow tigers: Leo who turns 12 this year, and any friends who are turning 24, 36, 48, 60, 72 or more, it's going to be a lucky year for us! || Put ? this ? on ? your ? status ? if ? you ? know ? someone ? who ? has ? or ? had ? cancer! ? All I want for Christmas is a CURE! ? || We Wish You a Merry??*¨*.¸¸? ¸¸.*¨*?? Christmas??*¨*.¸¸? ¸¸.*¨*??We Wish You a Merry ??*¨*.¸¸? ¸¸.*¨*??Christmas ? ? ?We Wish You A Merry ??*¨*.¸¸? ¸¸.*¨*??Christmas ??*¨*.¸¸? ¸¸.*¨*??...And A Happy New Year!??*¨*.¸¸? ¸¸.*¨*??... Copy and paste~keep the wave going! || If you are a parent with the greatest kids on earth then copy and repost this and let's give our kids the recognition they need! I am proud of my children. || no-class stadium for a no-class coach :( but I did park on someone's drive for $20 instead of the $60 that I would have had to give to USuCk || Back home from an evening of ""Enlightened Debauchery"" and no Walt Whitman in sight. There was this one guy from NY saying something about leaves of grass.... || My wonderful husband bought me a really fast computer (the old one caught a Trojan). The remaining 15 pages will just fly by. Thank you *PROPNAME* || My son breaks his ankle on the football field and his only concern is that he missed the pool party with the cheerleaders! || Question: How does one get 8th graders to shut the ____up?! *PROPNAME*? *PROPNAME*? *PROPNAME*? *PROPNAME*? I know you know - I'm exhausted. || I went sailing  today with the Fergies and Rich Pearsall. I polluted the Pacific a little more that it was alreaddy ;( || Wow, I'm stupid - I can't count in monthly increments. I actually have one more month to complete this f____ thesis!!! || there will be no Magic Mountain fireworks on the 4th. Perhaps you guys don't want this independence thingy after all || just dropped in on my lovely Italian friend - now feel the need for agnello e risotto a funghi || It's our anniversary - 16 years ago today, the Rassool family landed in California to pursue the American Dream.... || for those of you who asked, the port was an '85 ""*PROPNAME*"" from Vila Nova de Gaia, Portugal || It was so nearly the perfect football day - UCLA won again, but then USC came from behind || It's a lovely day in the neighbo[u]rhood when UCLA win AND the University for Spoiled Children lose :) || to whom it may concern, have a great first day at school today. and make good choices || did someone already tell me the difference between news feed and live feed? Sorry, I wasn't listening || I may be the only *PROPNAME* in the world - I'm definitely the only one on Facebook. || Haagen-Dazs ""Baileys"" ice cream, straight out of the pot - the perfect accompaniment for thesis writing || We will miss the Moos-Rubins, but we're looking forward to another great evening at the Bowl. || has just completed sexual harassment training - now I can be really good at it! || First day as a high school English teacher. Apparently, an English accent fools 'em. || It's *PROPNAME*'s birthday in about 45 minutes, but he ""doesn't want a surprise party!"" || I have at least one crazy child who is back on the football field!! || This teacher got an apple today - and grapes, strawberries, and cream! || it's too close - we're not used to playing in the cold || I now have a master's degree - ABT (all but thesis)! || Now *PROPNAME* is asking ""when's my party? "" Who predicted that?! || One syllabus down, one to go, but I got distracted. || My first English department meeting; I was expecting fisticuffs || Thesis approved! NOW can someone give me a job?! || our tree is naked! we can't find the skirt || my cousin keeps beating me at Bejewled Blitz! || nothing yet - it's my day off! || just discovered our dog barks at thunder! || Happy Father's Day to all you Dads || finally, raspberry pink, white, and grey || My second favorite team - Arizona!!! || I'm almost ready to submit. || I have a new job!!!",low,high,low,low,high,01001
933791b8623dadbb82664c60db91fb7e,"This actually works!: The Facebook Trick: Press Up, Up, Down, Down, Left, Right, Left, Right, B, A, enter key then right click. Then press up then down & magic circles will appear! Put this as your status IF IT WORKED FOR YOU! || thanks *PROPNAME* and *PROPNAME* for the gorgeous additions (especially the personalized jacket that she's showing off at work today) to her closet and the giant hole in her wallet. <3 || cannot speak due to throat pain.  This brings back memories of the first few days of school at Ramapo Middle.  Hopefully, this time there won't be racial slurs thrown around. || is looking for a wallet...Bed, Bath, & Beyond shoppers//employees...please be kind and save it from being ravaged until I can go back to your shop.  T_T || invites you to feel the magic of the holidays by visiting the Harry Potter exhibit at Museum of Science Boston on Dec. 12 (Sat). || thanks the kind soul who turned in her wallet, and dislikes whoever took $100 out (holiday shopping now looks a lot less happy). || has 28 teeth left.  At this rate of loss (2//decade), she'll be toothless by age 160...not too bad.  :| <--currently cannot grin//smile || realizes that she probably can't afford (staying alive-wise) to pig out on sweets around Harvard Square everytime she has dance practice. || wishes that her experiments would WORK when she's in the lab, especially when she's staying past normal going home time. D: || is sad that she's shorter than the shortest semi-finalist on cycle 13 of ANTM (*PROPNAME*'s French accent is SCARY). || needs to reset because the recent bout of failing Westerns clearly indicates there is a bug in the system. || needs to Wii Fit Plus more in order to stay in shape for dance (why yes, that does count). || is sad to discover that 8+ hours of sleep is needed to keep this old(er) body going. || is using the excellent combination of juice and calories to tip the balance between sickness and health. || wishes it was as warm out as the sunny blue sky with wispy clouds seems to indicate. || must work hard today so that she can go home before the super heavy snowfall starts. || feels satisfied with where she is in life for the first B(ig)day in a long time. || s doctor is sick...so all her preparations for pain is not needed for another two weeks. || is rewatching the first half of Knock Knock Loving You (the only portion worth watching). || sees that People's Republic of China turns 60 today, but finds Mom's birthday more important. || can speak again!  (As long as you ignore the occasional bouts of severe coughing.) || hasn't yet watched this week's episode of Castle (and thus is failing at life!!!). || finds a good mix of farming, socializing, and killing monsters to be very therapeutic. || plans to visit Orlando (Harry Potter! Sun!) during April's long weekend (go Patriot's Day!). || wishes all a very very awesome new year full of laughter and joy. || was too busy watching Castle last night (fashion! murder! mayhem!) to upload pics. || wants to know who (is in Boston and) wants to see Avenue Q! || is feeling >70% and can stop letting work get delayed. (= happiness) || clearly needs to transfer new pictures from her camera to her computer. || is awed by how 30 minutes can triple her RAM.  <3 || is looking for her face again (where is that camera cord?!). || has finally made it to Part III of *PROPNAME*'s Immunobiology book. || is going to see if Chinese dance is in her future. || is ready for Baltimore!  (Is Baltimore ready for Hua?  Maybe not...) || must eat lots of sticky and crunchy food before Thursday morning! || has landed in Boston and is back at work.  :D || won't have any wisdom teeth left in 24 hours.  :( || is going to eat ice cream cake before lunch.  :D || now believes in the ""bad things come in threes"" proverb. || is super excited about the first day of dance practice! || proves to be awesome at picking out paint colors. || has sore muscles from dancing too hard this weekend. || is looking forward to sunny Saturday in the park. || feels old after watching the sixth Harry Potter movie. || is super excited that Merlin season 2 has started!!! || is working on new profile pic as E-28. || is singing Christmas songs (to all of you!). || never realized that there was Boston Fashion Week. || now knows that flu vaccines are not friends. || dislikes how utterly miserable the weather outside is.",high,low,high,high,high,10111
94c07315276329eaf9beb29b759d4442,"Yay! Left my flash drive inside a computer in a PACKED math lab yesterday. Called the office today and asked them to check and it was still there! Now I can go back to sleep; woke up early to call them before anyone found it. Zzzz || I just had a dream that combined The Grudge + Twilight + Harry Potter + Pokemon. Malfoy had unsealed the Grudge demon from within Bella and Bulbasaur and Jigglypuff had to save the world. WTF? That doesn't even make sense. || woke up laughing after thinking in my dream ""Good thing zombies are so slow..."", then a zombie drives by in a car screaming ""NOT IF WE LEARNED HOW TO DRIVE"", and promptly crashes into a wall. :D || You know in Spiderman where he wakes up, puts on his glasses and realizes he doesn't need them anymore? Yeah, I had that today then I realized I had my contacts on. -.- || Computer case coming from South LA. Everything else coming from Tennesee. I get to stare at the case and do nothing with it for 4 days. *PROPNAME*, why art thou so cruel? D: || saw ""IN TRANSIT TO ONTARIO, CA"" on my tracking information and thought ""WHY IS IT GOING TO CANADA?!"" Who knew there was a city named Ontario in California? :x || went to a run down dollar store and it was playing *PROPNAME*'s ""Canon in D."" I laughed the entire time I was in there. :D || //facepalm, the person who last used this book underlined all the bold words... WHY?!  Well, that's what you get for 5% retail price. >>; || It's 6am and I can't sleep cause I just finished ordering parts for a new computer. Too excited. I'm nerdy, AND WHAT? D: || Made the UC App my homepage to stop me from procrastinating. Wait. Why am I here. AHHHH *deletes all bookmarks* || just got a new chair. I don't know what ""passive lumbar support"" means, but damn does it feel good. || Spent the last 2 hours sitting in the dark happily listening to music way too loudly at 6am :) || heard someone at home depot ask a worker for ""that thing that makes holes 'n shit."" LOL || bought so many things during Cyber Monday, he's memorized his credit card number. :// || Mom just found out I'm an atheist and is trying to convert me. Ahahaha || Need a topic for my second UC prompt. Describe me in one word. GO! || Dilemnia: It's 3am and I wanted to blast music through my speakers. >:[ || has been awake for way too long, listening to music way too loudly. || Came 45minutes late to C++ final, still finished before everyone else. :D || IT'S 4M AND I'VE BEEN LYING IN BED FOR 2 HOURS. RAAAGEE || 7:15 chem classss, dieee D: *collapse on floor* zzzzzzzzzzzz || Buckyballs, I want my 6 hours back. >.> || passed out while reading about narcolepsy yesterday... || Damn sense, always getting in my way. || Internet downtime, ending procrastination since 1996. || Baking in my room. TT || Free shipping is my downfall. || I hate you lab write-ups.",low,low,low,low,high,00001
96487b200f227f3f845bb8851dad2139,"Remember, remember, the Fifth of November, the Gunpowder Treason and Plot. I know of no reason why the Gunpowder Treason should ever be forgot... But what of the man? || just bought Five Finger Death Punch: The Way of The Fist as well as Breaking *PROPNAME*: Dear Agony, dilemma or what?! Votes below :) || Is disappointed that his new watch did not come in a Heart-Shaped Box.  Cringe I know but I'm bored :( || will engage his brain before asking anyone if they are free on the 14th of February in future :// || needs sleep but doesn't want it to stop being tonight. Damn sleep is an awful habit. || thinks some people really need to learn to act their age. || is in a good mood, which is a nice change. || is bored being back home already. || needs something to do tonight.",low,high,low,low,low,01000
